<?xml version="1.0" encoding="UTF-8"?>
<image xmlns="http://www.sanger.ac.uk/Software/Pfam/xml/pfamDomainGraphics.xsd" xmlns:xsi="http://www.w3.org/2001/XMLSchema-instance" xsi:schemaLocation="http://www.sanger.ac.uk/Software/Pfam/xml/pfamDomainGraphics.xsd http://www.sanger.ac.uk/Software/Pfam/xml/pfamDomainGraphics.xsd" format="png" layout="continuous" scale_x="0.5" scale_y="1.0">
    <sequence length="400" name="Partial">
        <region start="10" end="110" label="PartN" link_URL="/">
            <colour1>
                <colour><hex hexcode="9999ff"/></colour>
            </colour1>
            <colour2>
                <colour><hex hexcode="99ccff"/></colour>
            </colour2>
            <bigShape leftStyle="jagged" rightStyle="curved"/>
        </region>
        <region start="210" end="350" label="PartC" link_URL="/">
            <colour1>
                <colour><hex hexcode="339999"/></colour>
            </colour1>
            <colour2>
                <colour><RGB R="51" G="204" B="204"/></colour>
            </colour2>
            <bigShape leftStyle="curved" rightStyle="jagged"/>
        </region>
				 <region start="115" end="200" label="PartN_C" link_URL="/">
            <colour1>
       			 <colour>
         			<hex hexcode="1fc01f"/>
        		</colour>
      			</colour1>
      			<colour2>
        			<colour>
          			<hex hexcode="47e847"/>
        			</colour>
      			</colour2>
            <bigShape leftStyle="jagged" rightStyle="jagged"/>
        </region>
    </sequence>
</image>